{
  "id": "ui-components",
  "name": "UI Components & Interface Sprites",
  "description": "Comprehensive sprite library for user interface components, layouts, forms, and interactive elements",
  "version": "1.0.0",
  "categories": {
    "forms": {
      "name": "Form Elements",
      "description": "Input fields, buttons, and form controls",
      "sprites": {
        "text-input": {
          "id": "forms/text-input",
          "name": "Text Input Field",
          "description": "Standard text input field with border and placeholder styling",
          "svg": "<rect x=\"0\" y=\"0\" width=\"200\" height=\"40\" rx=\"4\" fill=\"#ffffff\" stroke=\"#d1d5db\" stroke-width=\"2\"/><rect x=\"8\" y=\"8\" width=\"184\" height=\"24\" rx=\"2\" fill=\"#f9fafb\"/><text x=\"12\" y=\"24\" font-size=\"12\" fill=\"#9ca3af\" font-family=\"Arial, sans-serif\">Enter text here...</text><rect x=\"12\" y=\"28\" width=\"1\" height=\"8\" fill=\"#3b82f6\"><animate attributeName=\"opacity\" values=\"1;0;1\" dur=\"1s\" repeatCount=\"indefinite\"/></rect>",
          "viewBox": "0 0 200 40",
          "defaultSize": { "width": 200, "height": 40 },
          "tags": ["input", "text", "form", "field"]
        },
        "button-primary": {
          "id": "forms/button-primary",
          "name": "Primary Button",
          "description": "Primary action button with hover and focus states",
          "svg": "<rect x=\"0\" y=\"0\" width=\"120\" height=\"40\" rx=\"6\" fill=\"#3b82f6\" stroke=\"#2563eb\" stroke-width=\"1\"/><rect x=\"2\" y=\"2\" width=\"116\" height=\"36\" rx=\"4\" fill=\"#4f46e5\" opacity=\"0.1\"/><text x=\"60\" y=\"25\" text-anchor=\"middle\" font-size=\"14\" fill=\"#ffffff\" font-weight=\"600\" font-family=\"Arial, sans-serif\">Click Me</text>",
          "viewBox": "0 0 120 40",
          "defaultSize": { "width": 120, "height": 40 },
          "tags": ["button", "primary", "action", "cta"]
        },
        "checkbox": {
          "id": "forms/checkbox",
          "name": "Checkbox",
          "description": "Checkbox input with checked state indicator",
          "svg": "<rect x=\"0\" y=\"0\" width=\"20\" height=\"20\" rx=\"3\" fill=\"#ffffff\" stroke=\"#d1d5db\" stroke-width=\"2\"/><rect x=\"2\" y=\"2\" width=\"16\" height=\"16\" rx=\"2\" fill=\"#3b82f6\"/><path d=\"M6 10 L9 13 L14 7\" stroke=\"#ffffff\" stroke-width=\"2\" fill=\"none\" stroke-linecap=\"round\" stroke-linejoin=\"round\"/>",
          "viewBox": "0 0 20 20",
          "defaultSize": { "width": 20, "height": 20 },
          "tags": ["checkbox", "input", "form", "selection"]
        },
        "dropdown": {
          "id": "forms/dropdown",
          "name": "Dropdown Select",
          "description": "Dropdown selection menu with arrow indicator",
          "svg": "<rect x=\"0\" y=\"0\" width=\"160\" height=\"40\" rx=\"4\" fill=\"#ffffff\" stroke=\"#d1d5db\" stroke-width=\"2\"/><rect x=\"8\" y=\"8\" width=\"144\" height=\"24\" rx=\"2\" fill=\"#f9fafb\"/><text x=\"12\" y=\"24\" font-size=\"12\" fill=\"#374151\" font-family=\"Arial, sans-serif\">Select option</text><polygon points=\"140,15 150,15 145,25\" fill=\"#6b7280\"/>",
          "viewBox": "0 0 160 40",
          "defaultSize": { "width": 160, "height": 40 },
          "tags": ["dropdown", "select", "menu", "form"]
        }
      }
    },
    "layout": {
      "name": "Layout Components",
      "description": "Headers, sidebars, containers, and layout structures",
      "sprites": {
        "header": {
          "id": "layout/header",
          "name": "Page Header",
          "description": "Website header with navigation and branding area",
          "svg": "<rect x=\"0\" y=\"0\" width=\"300\" height=\"60\" rx=\"4\" fill=\"#1f2937\" stroke=\"#374151\" stroke-width=\"1\"/><rect x=\"10\" y=\"10\" width=\"80\" height=\"40\" rx=\"4\" fill=\"#3b82f6\" opacity=\"0.2\"/><text x=\"50\" y=\"32\" text-anchor=\"middle\" font-size=\"12\" fill=\"#ffffff\" font-weight=\"bold\" font-family=\"Arial, sans-serif\">LOGO</text><rect x=\"120\" y=\"20\" width=\"60\" height=\"20\" rx=\"2\" fill=\"#4b5563\"/><text x=\"150\" y=\"32\" text-anchor=\"middle\" font-size=\"10\" fill=\"#ffffff\" font-family=\"Arial, sans-serif\">Navigation</text><rect x=\"200\" y=\"20\" width=\"60\" height=\"20\" rx=\"2\" fill=\"#4b5563\"/><text x=\"230\" y=\"32\" text-anchor=\"middle\" font-size=\"10\" fill=\"#ffffff\" font-family=\"Arial, sans-serif\">Menu</text>",
          "viewBox": "0 0 300 60",
          "defaultSize": { "width": 300, "height": 60 },
          "tags": ["header", "navigation", "layout", "top"]
        },
        "sidebar": {
          "id": "layout/sidebar",
          "name": "Sidebar Navigation",
          "description": "Side navigation panel with menu items",
          "svg": "<rect x=\"0\" y=\"0\" width=\"80\" height=\"200\" rx=\"4\" fill=\"#f3f4f6\" stroke=\"#e5e7eb\" stroke-width=\"1\"/><rect x=\"10\" y=\"10\" width=\"60\" height=\"25\" rx=\"3\" fill=\"#3b82f6\" opacity=\"0.1\"/><text x=\"40\" y=\"25\" text-anchor=\"middle\" font-size=\"9\" fill=\"#374151\" font-weight=\"600\" font-family=\"Arial, sans-serif\">Menu 1</text><rect x=\"10\" y=\"45\" width=\"60\" height=\"25\" rx=\"3\" fill=\"#6b7280\" opacity=\"0.1\"/><text x=\"40\" y=\"60\" text-anchor=\"middle\" font-size=\"9\" fill=\"#374151\" font-family=\"Arial, sans-serif\">Menu 2</text><rect x=\"10\" y=\"80\" width=\"60\" height=\"25\" rx=\"3\" fill=\"#6b7280\" opacity=\"0.1\"/><text x=\"40\" y=\"95\" text-anchor=\"middle\" font-size=\"9\" fill=\"#374151\" font-family=\"Arial, sans-serif\">Menu 3</text><rect x=\"10\" y=\"115\" width=\"60\" height=\"25\" rx=\"3\" fill=\"#6b7280\" opacity=\"0.1\"/><text x=\"40\" y=\"130\" text-anchor=\"middle\" font-size=\"9\" fill=\"#374151\" font-family=\"Arial, sans-serif\">Menu 4</text>",
          "viewBox": "0 0 80 200",
          "defaultSize": { "width": 80, "height": 200 },
          "tags": ["sidebar", "navigation", "menu", "layout"]
        },
        "card": {
          "id": "layout/card",
          "name": "Content Card",
          "description": "Card component with header, content, and action areas",
          "svg": "<rect x=\"0\" y=\"0\" width=\"200\" height=\"150\" rx=\"8\" fill=\"#ffffff\" stroke=\"#e5e7eb\" stroke-width=\"1\"/><rect x=\"0\" y=\"0\" width=\"200\" height=\"40\" rx=\"8\" fill=\"#f9fafb\"/><rect x=\"0\" y=\"32\" width=\"200\" height=\"8\" rx=\"0\" fill=\"#f9fafb\"/><text x=\"15\" y=\"25\" font-size=\"14\" fill=\"#111827\" font-weight=\"600\" font-family=\"Arial, sans-serif\">Card Title</text><rect x=\"15\" y=\"55\" width=\"170\" height=\"4\" rx=\"2\" fill=\"#d1d5db\"/><rect x=\"15\" y=\"65\" width=\"140\" height=\"4\" rx=\"2\" fill=\"#d1d5db\"/><rect x=\"15\" y=\"75\" width=\"160\" height=\"4\" rx=\"2\" fill=\"#d1d5db\"/><rect x=\"15\" y=\"85\" width=\"120\" height=\"4\" rx=\"2\" fill=\"#d1d5db\"/><rect x=\"15\" y=\"110\" width=\"80\" height=\"25\" rx=\"4\" fill=\"#3b82f6\"/><text x=\"55\" y=\"125\" text-anchor=\"middle\" font-size=\"10\" fill=\"#ffffff\" font-weight=\"600\" font-family=\"Arial, sans-serif\">Action</text>",
          "viewBox": "0 0 200 150",
          "defaultSize": { "width": 200, "height": 150 },
          "tags": ["card", "content", "container", "component"]
        }
      }
    },
    "interactive": {
      "name": "Interactive Elements",
      "description": "Modals, tooltips, notifications, and interactive components",
      "sprites": {
        "modal": {
          "id": "interactive/modal",
          "name": "Modal Dialog",
          "description": "Modal dialog overlay with content area and close button",
          "svg": "<rect x=\"0\" y=\"0\" width=\"250\" height=\"180\" rx=\"0\" fill=\"#000000\" opacity=\"0.5\"/><rect x=\"25\" y=\"25\" width=\"200\" height=\"130\" rx=\"8\" fill=\"#ffffff\" stroke=\"#e5e7eb\" stroke-width=\"1\"/><rect x=\"25\" y=\"25\" width=\"200\" height=\"40\" rx=\"8\" fill=\"#f9fafb\"/><rect x=\"25\" y=\"57\" width=\"200\" height=\"8\" rx=\"0\" fill=\"#f9fafb\"/><text x=\"40\" y=\"48\" font-size=\"14\" fill=\"#111827\" font-weight=\"600\" font-family=\"Arial, sans-serif\">Modal Title</text><circle cx=\"205\" cy=\"45\" r=\"8\" fill=\"#ef4444\"/><text x=\"205\" y=\"49\" text-anchor=\"middle\" font-size=\"12\" fill=\"#ffffff\" font-weight=\"bold\" font-family=\"Arial, sans-serif\">Ã—</text><rect x=\"40\" y=\"80\" width=\"170\" height=\"4\" rx=\"2\" fill=\"#d1d5db\"/><rect x=\"40\" y=\"90\" width=\"140\" height=\"4\" rx=\"2\" fill=\"#d1d5db\"/><rect x=\"40\" y=\"100\" width=\"160\" height=\"4\" rx=\"2\" fill=\"#d1d5db\"/><rect x=\"40\" y=\"125\" width=\"70\" height=\"20\" rx=\"4\" fill=\"#3b82f6\"/><text x=\"75\" y=\"137\" text-anchor=\"middle\" font-size=\"9\" fill=\"#ffffff\" font-weight=\"600\" font-family=\"Arial, sans-serif\">Confirm</text><rect x=\"125\" y=\"125\" width=\"70\" height=\"20\" rx=\"4\" fill=\"#6b7280\"/><text x=\"160\" y=\"137\" text-anchor=\"middle\" font-size=\"9\" fill=\"#ffffff\" font-weight=\"600\" font-family=\"Arial, sans-serif\">Cancel</text>",
          "viewBox": "0 0 250 180",
          "defaultSize": { "width": 250, "height": 180 },
          "tags": ["modal", "dialog", "overlay", "popup"]
        },
        "notification": {
          "id": "interactive/notification",
          "name": "Notification Toast",
          "description": "Toast notification with icon and message",